ingredient_name,INCI_name,CAS_number,supplier_count,Source
Minoxidil,Minoxidil,38304-91-5,70+,EUROAPI, Gangwal Healthcare, BASF
Biotin (Vitamin B7),Biotin,58-85-5,120+,DSM-Firmenich, Seiwa Kasei
Caffeine,Caffeine,58-08-2,150+,Actichem, Special Chemicals, Algaktiv
Copper Peptides (GHK-Cu),Copper Tripeptide-1,89030-95-5,40+,A&PEP, Seiwa Kasei
Niacinamide (Vitamin B3),Niacinamide,98-92-0,130+,Inolex, DSM-Firmenich
Panthenol (Pro-Vitamin B5),Panthenol,81-13-0,100+,Univar, TSI Health Sciences
Adenosine,Adenosine,58-61-7,50+,Natural Micron Chem Tech, Shaanxi Huatai Bio-Fine Chemical, Xi'an Aoge Biotech
Azelaic Acid,Azelaic Acid,123-99-9,35+,Azeco, Acme-Hardesty, Azelaic Products
