source_id,abstract,included_plant_compound,matched_name,no,included_target
9731116,"The dependence of intracellular glutathione (GSH), an important radical scavenger, on aging with or without externally applied Ginkgo biloba extract EGb 761, another established radical scavenger, was studied in guinea pig M¿ller (retinal glial) cells by using the fluorescent dye monochlorobimane. The GSH content of freshly dissociated cells from untreated aged animals was significantly lower than that of young controls; most of this reduction was prevented by application of EGb 761. Culturing the cells in amino-acid-free caused a loss of up to 50% of the initial GSH content. When the culture medium contained 100 microM glutamate and 100 microM cystine, ongoing GSH synthesis counteracted the loss of GSH. The rates of net GSH synthesis were equal for the two groups of aged animals but significantly higher for cells from young controls. It is concluded that externally applied radical scavengers may enhance the protective glutathione 'reserve' of M¿ller cells in cases of neuronal degeneration.",Ginkgo nut,Ginkgo biloba,17,GSH
9951643,"A study was carried out to investigate the effect of two antioxidants--Ginkgo biloba extract (EGb761) and superoxide dismutase (SOD)--in an experimental model of vitreoretinopathy obtained by direct production of oxygen free radicals in the vitreous cavity. Twenty-eight pigmented rabbits were used. Vitreoretinopathy was induced by intravitreal injection of 50 microliters of a mixture composed of 40 nmol of xanthine and 0.001 IU of xanthine oxidase. Rabbits were randomly distributed into four groups: Group 1 (n = 8) did not receive any treatment and served as a positive control. Groups 2 (n = 8) and 3 (n = 8) received for 1 month EGb761 given orally at a dose of 100 mg/kg/day, respectively 1 day after and 1 week before induction of retinopathy. Group 4 (n = 4) was treated by three intramuscular injections of 15,000 IU/kg of SOD, 24 h before induction and 24 and 48 h thereafter. Clinical evaluations and electroretinograms (ERG) were repeatedly performed until the animals were killed at day 28. Histological examinations and immunohistological procedures were performed to ascertain the origin and characteristics of the cellular proliferation and to compare vitreoretinal structures in the four groups. Intravitreal injection of xanthine-xanthine oxidase produced a strong inflammatory response with vitreous infiltrates and epiretinal membrane formation, inconstantly associated with retinal detachment. ERG showed a decrease of the a-, b- and c-waves beginning within a few hours after injection. Histologic evaluation found an intravitreal and epiretinal infiltration by leukocytes and epithelial-derived cells, dense vitreoretinal membranes and retinal detachments with occasional neovascularization. In the treated groups (groups 2-4), all clinical, electric and histologic data were significantly improved compared to the control group. However, no difference could be found among the three treated groups. This study demonstrates the strong pathologic effects of free radical production on the retina and the close relationships between free radicals, inflammatory pathways and vitreoretinal proliferative disorders. It also confirms the pharmacological interest of prevention by antioxidants and free radical scavengers.",Ginkgo nut,Ginkgo biloba,17,SOD
10318710,"Recent structure-function analysis of heterologously expressed K+-selective inward-rectifying channels (KIRCs) from plants has revealed that external protons can have opposite effects on different members of the same gene family. An important question is how the diverse response of KIRCs to apoplastic pH is reflected at the tissue level. Activation of KIRCs by acid external pH is well documented for guard cells, but no other tissue has yet been studied. In this paper we present, for the first time to our knowledge, in planta characterization of the effects of apoplastic pH on KIRCs in roots. Patch-clamp experiments on protoplasts derived from barley (Hordeum vulgare) roots showed that a decrease in external pH shifted the half-activation potential to more positive voltages and increased the limit conductance. The resulting enhancement of the KIRC current, together with the characteristic voltage dependence, strongly relates the KIRC of barley root cells to AKT1-type as opposed to AKT3-type channels. Measurements of cell wall pH in barley roots with fluorescent dye revealed a bulk apoplastic pH close to the pK values of KIRC activation and significant acidification of the apoplast after the addition of fusicoccin. These results indicate that channel-mediated K+ uptake may be linked to development, growth, and stress responses of root cells via the activity of H+-translocating systems.",Malted barley,Hordeum vulgare,35,AKT1
10417721,"Protection against desiccation-induced injury, including damage by reactive oxygen species (ROS), is a necessary component of the genetic programmes active during late seed development. Likewise, protection against ROS respiration by-products is required during seed imbibition and germination. Late embryogenesis abundant (LEA) proteins are proposed to protect seed tissues against desiccation-induced damage. Specifically, the atypical Lea gene Per1 in barley (Hordeum vulgare L.) has been proposed to play a protective role in embryo and aleurone cells against free-radical damage during late seed development and early imbibition. PER1 represents a subgroup of the peroxiredoxin family of thiol-requiring anti-oxidants with one conserved cysteine residue (1-Cys), and displays in vitro anti-oxidant activity. In this work, we use antiserum generated against PER1 to study protein accumulation patterns as well as localization at the tissue, cellular and subcellular level. While previous studies have shown the Per1 transcript to be dormancy-related, we show here that the protein level is maintained in imbibed dormant seeds, but not in non-dormant seeds. Our data identify the location of this seed-specific peroxiredoxin as the nucleus of immature embryos and aleurone layers. Highest levels of protein are detected in nucleoli. In contrast, in mature imbibed dormant seeds, cytosolic levels are comparable to that of the nucleus. A putative nuclear localization signal (NLS) of bipartite nature was identified in the C-terminal end of the PER1 sequence. Protective roles for PER1 in seeds are discussed.",Malted barley,Hordeum vulgare,35,ROS
10438161,"This study was done to evaluate the possible preventive effects of reactive oxygen species (ROS) scavenger agent desferrioxamine (DFX) and platelet-activating factor (PAF) antagonist agent ginkgo biloba (GB) in an experimental acute pancreatitis model. Seventy-eight CD-1 mice were divided into six groups consisting of 10-13 mice. Induction of pancreatitis was achieved by cerulein injection in groups 2-5. The first group was control, whereas DFX and GB were used alone or in combinations as preventive agents in groups 3-5. DFX or GB were injected to the mice in groups 6 and 7 to evaluate any toxic effect. The assessment of the pancreatic edema and inflammation, the measurement of the amylase and the pancreatic weight and the measurement of the pancreatic tissue oxidative capacity by chemiluminescence method were the parameters to evaluate pancreatitis. Although the results indicate DFX and GB alone or in combinations have significant preventive roles, this was not a complete prevention.",Ginkgo nut,Ginkgo biloba,17,ROS
10487222,"A cDNA, hvst1, was isolated from Hordeum vulgare by heterologous complementation in Escherichia coli. This cDNA encodes a high-affinity sulfate transporter that is 2442 bp in length and consists of 660 amino acids. Under steady-state conditions of sulfate supply during culture, sulfate influx (measured at 100 microM external sulfate concentration) and hvst1 transcript level were inversely correlated with sulfate concentrations in the culture solution. Glutathione (GSH) concentrations increased as external sulfate was increased from 2.5 to 250 microM. A time-course study, designed to investigate effects of sulfate withdrawal on the abundance of hvst1 transcript, showed a 5-fold increase of the latter within the first two hours. This was followed by a further slight increase during the next 46 h. These changes were accompanied by a parallel increase in sulfate influx and a decrease of root GSH concentrations. When plants that had been deprived of sulfate for 24 h were exposed to L-cysteine (Cys) or GSH for 3 h, GSH was the more effective down-regulator, reducing hvst1 transcript level to below that of unstarved controls. The decrease in transcript abundance induced by sulfate or Cys was partially relieved by the addition of buthionine sulfoximine (BSO), an inhibitor of GSH synthesis. Both hvst1 transcripts and sulfate influx increased as a function of N supply to N-starved plants. Amino oxyacetate acid (AOA), an aminotransferase inhibitor, when supplied with NO3-, increased transcript abundance of hvst1, while tungstate, methionine sulfoximine (MSO) and azaserine (AZA), inhibitors of nitrate reductase, glutamine synthetase and glutamate synthase (GOGAT), respectively, were without effect. AOA decreased root concentrations of aspartate (Asp), Cys and GSH; in contrast, glutamate (Glu) concentrations remained unchanged.",Malted barley,Hordeum vulgare,35,GSH
10490274,"A great number of epidemiological studies have demonstrated that the frequency of the epsilon4 allele of the apolipoprotein E gene (APOE) is markedly higher in sporadic and in familial late onset Alzheimer disease (AD). In the frontal cortex of AD patients, oxidative damage is elevated. We address the hypothesis that the APOE genotype and reactive oxygen-mediated damage are linked in the frontal cortex of AD patients. We have related the APOE genotype to the levels of lipid oxidation (LPO) and to the antioxidant status, in frontal cortex tissues from age-matched control and AD cases with different APOE genotypes. LPO levels were significantly elevated in tissues from Alzheimer's cases which are homozygous for the epsilon4 allele of APOE, compared to AD epsilon3/epsilon3 cases and controls. Activities of enzymatic antioxidants, such as catalase and glutathione peroxidase (GSH-PX), were also higher in AD cases with at least one epsilon4 allele of APOE, while superoxide dismutase (SOD) activity was unchanged. In the frontal cortex, the concentration of apoE protein was not different between controls and AD cases, and was genotype independent. The Ginkgo biloba extract (EGb 761), the neurosteroid dehydroepiandrosterone (DHEA) and human recombinant apoE3 (hapoE3rec) were able to protect control, AD epsilon3/epsilon3 and epsilon3/epsilon4 cases against hydrogen peroxide/iron-induced LPO, while hapoE4rec was completely ineffective. Moreover, EGb 761 and DHEA had no effect in homozygous epsilon4 cases. These results demonstrate that oxidative stress-induced injury and protection by antioxidants in the frontal cortex of AD cases are related to the APOE genotype.",Ginkgo nut,Ginkgo biloba,17,SOD; GSH
10535759,"Excessive production of nitric oxide (NO) may have cytotoxic effects through the formation of peroxynitrite with superoxide. The extract of Ginkgo biloba leaves (EGb) has been demonstrated to be a potent scavenger of free radicals. Although EGb has been shown recently to inhibit NO production in macrophages, its effect on NO production in endothelial cells is largely unknown. The objective of this study was to elucidate the mechanism by which EGb affects NO production in a human endothelial cell line (ECV304). After cells were incubated with EGb (10-100 microg/mL) for 2 or 4 hr, the amounts of NO metabolites released by the cells were quantitated, and cellular NOS activities were determined following the conversion of [3H]arginine to [3H]citrulline. NOS protein expression was determined by western immunoblotting analysis. mRNA levels were examined by reverse transcription-polymerase chain reaction (RT-PCR) analysis. EGb (50 microg/mL) caused a 30% reduction of NO metabolites released by endothelial cells. Following EGb treatment, cellular inducible NO synthase (iNOS) activity was reduced by 28% with a concomitant reduction in the levels of iNOS protein mass and mRNA. There was no change in the activity or protein mass of constitutive NO synthase in these cells. EGb inhibited NO production by attenuating the level of iNOS mRNA in ECV304 cells. Selective inhibition of iNOS by EGb may be therapeutically relevant in modulating NO production in endothelial cells.",Ginkgo nut,Ginkgo biloba,17,NO
10547088,"This study was conducted to evaluate the effect of Ginkgo biloba extract (EGb 761) on the nitric oxide (NO) production in relation to the recovery of postischemic cardiac function in isolated working rat hearts. Rats were orally treated with various doses (25, 50, 75, and 100 mg/kg/day) of EGb 761 for 10 days. Hearts were isolated in ""working mode"" and subjected to 30-min ischemia followed by 120 min of reperfusion. EGb 761 inhibited NO production measured by electron spin-resonance spectroscopy (ESR), and improved the recovery of postischemic cardiac function (coronary flow, aortic flow, left ventricular developed pressure and its first derivative) in the ischemic/reperfused myocardium. Thus in rats treated with 25, 50, 75, and 100 mg/kg/day of EGb 761 and in hearts subjected to 30-min ischemia followed by 120 min of reperfusion, aortic flow was increased from its postischemic drug-free control value of 8.0+/-0.4 to 8.6+/-0.4 ml/min (NS), 17.3+/-0.9 ml/min (p0.05), 21.5+/-1.1 ml/min (p0.05), and 23.6+/-1.2 ml/min, respectively. The same recovery in postischemic coronary flow, left ventricular developed pressure, and its first derivative also was observed. In the initial phase of reperfusion, NO production measured by ESR was reduced by 85% in the 75 mg/ kg/day of EGb 761-treated group in comparison with the drug-free ischemic/reperfused hearts. Inducible NO synthase (iNOS) messenger RNA (mRNA) measured by reverse transcription-polymerase chain reaction (RT-PCR) also was reduced by 41 and 58% in the groups treated with 75 and 100 mg/kg/day of EGb 761, respectively. Our findings show that EGb 761 directly acts as an NO scavenger and concomitantly inhibits the expression of iNOS mRNA. Thus, EGb 761 may act as a potent inhibitor of NO production under the condition of ischemia/reperfusion, improving the recovery of postischemic cardiac function.",Ginkgo nut,Ginkgo biloba,17,NO
10552591,"The coding region of the copper/zinc superoxide dismutase (Cu/Zn SOD) cDNA from papaya fruit, Carica papaya L. cv. Tainong 2, was cloned into an expression vector, pET-20b(+). The Cu/Zn SOD was expressed in Escherichia coli and purified by His-tag technique. Two active forms of the enzyme (30% dimer and 70% monomer) in equilibrium were observed. The activity of the dimeric enzyme was higher than that of the monomeric form. The thermal inactivation rate constant K(d) values calculated for the dimer and monomer at 90 degrees C were -0.0203 and -0.0216 min(-1), and the half-lives for inactivation were 41.9 and 31.8 min, respectively. This indicated that the dimeric enzyme was more stable than its monomeric form. The dimerization of the enzyme was inhibited under acidic pH (below 3.0) or imidazole buffer (above 0.5 M), whereas it was not affected under alkaline pH (above 9.0). Both activity and forms of the enzyme were not affected by 1-4% SDS. Furthermore, the dimeric enzyme was much more resistant to proteolytic attack after 3 h of incubation at 37 degrees C with trypsin or chymotrypsin. In addition, mutation of the papaya Cu/Zn SOD at position 48 from Leu to Phe (L48F) affected the association of monomer, whereas a mutant with Lys substitution (L48K) at the same position tended to dissociate into monomeric form.",Papaya,Carica papaya,11,SOD
10554243,"A full-length complementary DNA (cDNA) clone encoding a putative copper/zinc superoxide dismutase (Cu/Zn SOD) of papaya fruit, Carica papaya L. cv. Tainong 2, was amplified according to the polymerase chain reaction technique from cDNA synthesized from fruit messenger RNA. Nucleotide sequence analysis of this cDNA clone revealed that it comprised a complete open reading frame coding for 152 amino acid residues. The deduced amino acid sequence showed higher identity (81.6-84.9%) with the sequences of the cytosolic Cu/Zn SODs than those of the chloroplast from other plant species, and no recognizable plastid targeting peptide was found. These suggest that the papaya fruit cDNA clone encodes a cytosolic Cu/Zn SOD. The residues required for coordinating copper (His-45, -47, -62, and -119) and zinc (His-62, -70, and -79 and Asp-82), as well as the two cysteines (56 and 145) that form a single disulfide bond, are conserved as they are among all reported Cu/Zn SOD sequences. In addition, the coding region of Cu/Zn SOD cDNA from papaya was introduced into an expression vetor, pET-20b(+), and transformed into Escherichia coli AD494(DE3)pLysS. A predominant protein band was detected by Coomassie blue staining of native PAGE, and activity staining confirmed the result of Coomassie blue staining. These indicate that this Cu/Zn SOD cDNA clone can overexpress active Cu/Zn SOD enzyme in E. coli.",Papaya,Carica papaya,11,SOD
10575089,"""beta Amyloid (Abeta)-induced free radical-mediated neurotoxicity"" is a leading hypothesis as a cause of Alzheimer's disease (AD). Abeta increased free radical production and lipid peroxidation in PC12 nerve cells, leading to increased 4-hydroxy-2-nonenal (HNE) production and modification of specific mitochondrial target proteins, apoptosis and cell death. Pretreatment of the cells with isolated ginkgolides, the anti-oxidant component of Ginkgo biloba leaves, or vitamin E, prevented the Abeta-induced increase of reactive oxygen species (ROS). Ginkgolides, but not vitamin E, inhibited the Abeta-induced HNE modification of mitochondrial proteins. However, treatment with these anti-oxidants did not rescue the cells from Abeta-induced apoptosis and cell death. These results indicate that free radicals and lipid peroxidation may not mediate Abeta-induced neurotoxicity.",Ginkgo nut,Ginkgo biloba,17,ROS
10631257,"Hordeins, the natural substrates of barley (Hordeum vulgare) cysteine endoproteases (EPs), were isolated as protein bodies and degraded by purified EP-B from green barley malt. Cleavage specificity was determined by synthesizing internally quenched, fluorogenic tetrapeptide substrates of the general formula 2-aminobenzoyl-P(2)-P(1)-P(1)'-P(2)' 1-tyrosine(NO(2))-aspartate. The barley EPs preferred neutral amino acids with large aliphatic and nonpolar (leucine, valine, isoleucine, and methionine) or aromatic (phenylalanine, tyrosine, and tryptophan) side chains at P(2), and showed less specificity at P(1), although asparagine, aspartate, valine, and isoleucine were particularly unfavorable. Peptides with proline at P(1) or P(1)' were extremely poor substrates. Cleavage sites with EP-A and EP-B preferred substrate sequences are found in hordeins, their natural substrates. The substrate specificity of EP-B with synthetic peptides was used successfully to predict the cleavage sites in the C-terminal extension of barley beta-amylase. When all of the primary cleavage sites in C hordein, which occur mainly in the N- and C-terminal domains, were removed by site-directed mutagenesis, the resulting protein was degraded 112 times more slowly than wild-type C hordein. We suggest that removal of the C hordein terminal domains is necessary for unfolding of the beta-reverse turn helix of the central repeat domain, which then becomes more susceptible to proteolytic attack by EP-B.",Malted barley,Barley malt,35,NO
10631268,"To explore possible pathways for anions to enter the xylem in the root during the transport of salts to the shoot, we used the patch-clamp method on protoplasts prepared from the xylem parenchyma of barley (Hordeum vulgare L.) plants. K(+) currents were suppressed by tetraethylammonium or N-methylglucamine in the solutions in the pipette and the bath, and the permeating anions were Cl(-) or NO(3)(-). We recorded the activities of three distinct anion conductances: (a) an inwardly rectifying anion channel (X-IRAC), characterized by activation at hyperpolarization and open times of up to several seconds; (b) a quickly activating anion conductance (X-QUAC), important for anion efflux at voltages between -50 mV and the equilibrium potential of the prevailing anion; and (c) a slowly activating anion conductance (X-SLAC), activating above -100 mV. Both X-IRAC and X-QUAC were permeable for Cl(-) and NO(3)(-); X-QUAC was also permeable for malate. The occurrence of X-IRAC became more frequent with an increase in cytoplasmic Ca(2+), while the occurrence of X-QUAC decreased. Anion currents through X-SLAC, and particularly through X-QUAC, were estimated to be large enough to account for reported rates of xylem loading, which is in accordance with the notion that xylem loading is a passive process.",Malted barley,Hordeum vulgare,35,NO
10647922,"The effect of several natural and synthetic compounds on selenite-induced cataract was investigated in rat pups. Simultaneous determination of glutathione S-transferase (GST), selenium dependent glutathione peroxidase (Se-GPx), catalase (CAT), superoxide dismutase (SOD) activities and malondialdehyde (MDA) levels were carried out in the lens, erythrocyte and plasma. The results showed that propolis, diclofenac, vitamin C (Vit-C) and quercetin prevented cataract formation to the extent of 70, 60, 58.4, and 40%, respectively. Standardized extract of Ginkgo biloba (Egb 761) did not affect the cataract formation. Selenite treatment caused a significant decrease in the activity of erythrocyte SOD. This was accompanied by a simultaneous increase in the levels of MDA either in lens and in plasma. A significant increase was shown in erythrocyte GST (substrate ethacrynic acid; eaa), and GPx activities and lens GST (substrate chlorodinitro benzene; cdnb) activity. Antioxidant treatment caused significant changes in enzyme activities and MDA levels. There was no effect of selenite and antioxidants on total body weight increase during the course of the study. Blood parameters did not correlate to lens parameters following selenite treatment. Our results suggest that antioxidant supplementation following selenite exposure may prevent the cataract formation and may enhance antioxidant defence of blood and lens.",Ginkgo nut,Ginkgo biloba,17,SOD
10678500,"Free radicals are involved in numerous skin diseases, especially inflammatory reactions and photosenescence. To identify possible free-radical scavenging by an original terpene-free Ginkgo biloba extract containing 33% Ginkgo flavone glycosides, mostly quercetin and kaempferol derivatives, we studied its activity by means of in-vitro and in-vivo experiments, using superoxide dismutase (SOD) as a positive control. By means of an in-vitro electron-spin resonance (ESR) assay we compared the activity of the Ginkgo extract with that of its two aglycones, quercetin and kaempferol. Quercetin and Ginkgo extract had significant antioxidant properties without pro-oxidant effect. In contrast, kaempferol, above an optimum antioxidant concentration, behaved as a pro-oxidant. The in-vivo experiments were conducted on an anti-inflammatory model. The cutaneous blood flux which reflects the skin inflammatory level was recorded by means of a laser Doppler perfusion imager. The data confirmed the free-radical-scavenging property of both Ginkgo extract and SOD. The Ginkgo extract significantly inhibited (37%) cutaneous blood flux to the same extent as SOD. These data confirmed the antioxidant property of Ginkgo extract. A complementary spin-trapping technique would enable identification of the free radicals involved. This Ginkgo extract should be useful for protection of the skin against free radicals.",Ginkgo nut,Ginkgo biloba,17,SOD
10712542,"Two full-length cDNAs, HvNRT2.3 and HvNRT2.4, were isolated from roots of barley (Hordeum vulgare), using reverse transcriptase-PCR and RACE-PCR. The corresponding polypeptides, consisting of 507 amino acids (molecular masses of 54.6 kD), belong to the major facilitator superfamily (MFS), and are closely related (87% identity) to those encoded by HvNRT2.1 and HvNRT2.2 (formerly BCH1 and BCH2, respectively) from roots of barley. The latter are considered to encode inducible high-affinity NO(3)(-) transporters (Trueman et al., 1996). HvNRT2 transcripts were undetectable in NO(3)(-)-deprived plants. Following exposure to either NO(3)(-) or NO(2)(-), transcript abundance and (13)NO(3)(-) influx increased to a maximum by 6 to 12 h, then declined in HvNRT2.1, HvNRT2.2, and HvNRT2.3. The pattern of HvNRT2.4 transcript abundance was different, remaining high after achieving peak abundance. When external NO(3)(-) concentrations were varied from 0 to 500 microM under steady-state conditions of NO(3)(-) supply, HvNRT2 transcript accumulation and (13)NO(3)(-) influx were highest in 50 microM NO(3)(-) -grown plants. When NH(4)(+) was provided together with NO(3)(-), transcript accumulation during the first 2 h was similar to that due to NO(3)(-) alone, but by 4 h the transcript level was significantly reduced. HvNRT2 transcript was undetectable in leaf tissues.",Malted barley,Hordeum vulgare,35,NO
