brand,product,ingredients,description,url,price_usd,size,format,rating,review_count,image_url
Abbott,Glucerna Diabetes Care Shake,"Slow-release carbs, milk protein isolate, vegetable oils, fiber blend, vitamins & minerals",Specialized nutrition shake designed to support blood sugar control using low-GI carbohydrate system,https://www.abbottnutrition.com/our-products/glucerna-original-shake,14.99,6×237 mL,ready-to-drink,4.6,1200,https://www.abbottnutrition.com/content/dam/an/abbottnutrition/products/Original/10001/X48905GLUOG1024.png
Nestlé,Resource Diabetic Powder,"Whey protein, resistant maltodextrin, MUFA oils, fiber complex, micronutrients",Nutritional powder formulated for glucose management and balanced macronutrient intake,https://www.nestlehealthscience.com.hk/en/brands/resource/resource-diabetic,26,400 g,powder,4.5,2,https://www.nestlehealthscience.com.hk/sites/default/files/2022-09/Resource-Diabetics-product-Light-Purple_r3_0.jpg
Abbott,Ensure Diabetes Care,"Protein blend, chromium complex, fiber system, slow-digest carbs",Meal-replacement style formula supporting glycemic stability and energy maintenance,https://www.family.abbott/in-en/ensure/products/ensure-diabetes-care.html,24.5,400 g,powder,4.4,310,https://www.family.abbott/adobe/dynamicmedia/deliver/dm-aid--b6545497-75d8-4520-b29a-61ad6c41eb89/375gm-vanilla-edc.png?quality=85&width=1024&preferwebp=true
Nutifood,Diabet Care Gold,"Isomaltulose carb system, plant oils, fiber blend, micronutrients",Diabetes-targeted formula supporting stable glucose release and metabolic nutrition,https://www.bachhoaxanh.com/sua-bot-cong-thuc/sb-diabetcare-gold-lon-900g-bhx,17.5,900 g,powder,4.4,210,https://cdn.tgdd.vn/Products/Images/2382/193905/bhx/sb-diabetcare-gold-lon-900g-bhx-2-700x467.jpg
HALAN,Diabetic Gold Care,"Low-GI carbohydrate complex, herbal extracts, protein mix, vitamins",Functional nutritional milk supporting glucose stabilization and immune support,https://bachhoa.extra.vn/sua-danh-cho-nguoi-tieu-duong-diabetic-gold-care-400g-dinh-duong-dac-biet-cho-nguoi-benh-tieu-duong-hsd-t6-2024-s15088865702.html,16.8,800 g,powder,4.3,95,https://cf.shopee.vn/file/sg-11134201-22100-anlsmqta26hvae